post_id,title,directory_id,level_id,user,description,excerpt,categories,locations,address_line_1,address_line_2,zip,latitude,longitude,map_icon_file,tags,images,videos,expiration_date,contact_email,claimable,file_upload,phone,event_date,additional_description,price,event_type,methods_of_payment,website,email,opening_hours
70,"Avenue florist",1,2,2,"Nulla"" gravida commodo est, sed euismod augue dictum ac. <strong>Maecenas non libero ante.</strong> Suspendisse non tellus nisl, vitae sodales neque. Pellentesque ornare auctor sem et pellentesque.
Integer vitae lectus in ipsum auctor accumsan. Aenean sapien tortor, laoreet sed venenatis quis, fermentum vel justo.'rnrnPraesent condimentum, elit et lacinia posuere, purus neque pretium massa, in elementum purus lacus sed urna. Donec varius eros sed sapien pellentesque laoreet venenatis nisi consequat.

Aenean gravida dapibus mollis. Praesent non nisl risus. Morbi dolor mauris, sodales sed bibendum et, interdum sed orci. Nullam ultrices, lorem eu commodo convallis, odio turpis fringilla lorem, eu auctor ipsum mi sed orci. In nibh velit, tempus in auctor in, adipiscing ut odio. Phasellus vitae purus turpis, ultricies aliquam metus. Suspendisse dignissim gravida rutrum. Nam commodo neque libero, et viverra libero.","Nulla gravida commodo est, sed euismod augue dictum ac. Maecenas non libero ante. Suspendisse non tellus nisl, vitae sodales neque.","Construction;United States>California>Chino;United States>California>Greenfield;United States>California>Fresno",,;;,;;,;;,34.012234;34.113087;33.990322,-117.688942;-118.189613;-118.308662,w2dc-fa-wrench;w2dc-fa-wrench;w2dc-fa-wrench,tag1;tag2;tag3,DSCN0618.jpg,,,,1,,"(123) 123-4444","11.12.2014 00:00","1
2
3",155.5,,,"http://www.salephpscripts.com>link text",admin@admin.com,"Mon 01:00 AM - 00:00 AM,Wed 00:00 AM - 00:00 AM,Thu 00:00 AM - 00:00 AM,Fri 00:00 AM - 00:00 AM,Sat 00:00 AM - 00:00 AM,Sun 00:00 AM - 00:00 AM"
